{
  "id": "permitgraph",
  "name": "PermitGraph",
  "tagline": "Deterministic obligation resolution for state business one-stop portals.",
  "status": "active",
  "phase": "spec",
  "featured": true,
  "order": 10,
  "role": "Architect and sole implementer",
  "period": {
    "start": "2026-08",
    "end": null
  },
  "problem": "Around twenty US states run partial business one-stop portals and about thirty run none. They fail identically: each agency owns its own form, and nobody owns the dependency order between them. An owner can find every individual requirement and still not know what to do first.",
  "outcome": null,
  "capabilities": [
    "deployment-architecture",
    "technical-blocker-resolution",
    "evaluation-and-measurement",
    "platform-modernization"
  ],
  "stack": [
    "LinkML",
    "JSON Schema",
    "SHACL",
    "CEL",
    "Go",
    "Python",
    "Postgres",
    "Terraform",
    "GCP Cloud Run"
  ],
  "repo": "https://github.com/wildgen3/permitgraph",
  "homepage": null,
  "artifacts": [
    {
      "label": "Architecture (C4)",
      "url": "https://github.com/wildgen3/permitgraph/blob/main/docs/09-architecture-c4.md"
    },
    {
      "label": "19 architecture decision records",
      "url": "https://github.com/wildgen3/permitgraph/blob/main/docs/adr/README.md"
    },
    {
      "label": "Rules DSL and its linter",
      "url": "https://github.com/wildgen3/permitgraph/blob/main/docs/06-rules-dsl.md"
    },
    {
      "label": "AGENTS.md \u2014 agent guardrails and the failure log",
      "url": "https://github.com/wildgen3/permitgraph/blob/main/AGENTS.md"
    }
  ],
  "case_study": "case-studies/permitgraph.md",
  "confidentiality": "clean-room"
}
