{
  "id": "fedora-blueprint",
  "name": "fedora-blueprint",
  "tagline": "Idempotent, dry-runnable post-install automation reproducing a full workstation from an audited inventory.",
  "status": "active",
  "phase": "production",
  "featured": false,
  "order": 30,
  "role": "Author",
  "period": { "start": "2026-08", "end": null },
  "problem": "A working development machine is an undocumented accumulation of decisions. Rebuilding one means rediscovering all of them.",
  "outcome": "Eighteen numbered idempotent modules reproduce the machine from a captured inventory, with --dry-run on every path.",
  "capabilities": ["deployment-architecture", "workload-transition"],
  "stack": ["Bash", "dnf", "Flatpak", "systemd", "rclone"],
  "repo": "https://github.com/wildgen3/fedora-blueprint",
  "homepage": null,
  "artifacts": [],
  "case_study": null,
  "confidentiality": "private-summary"
}
